{
    "replace": true,
    "slots": [
        "shield/plate"
    ],
    "materialSlotCount": 0,
    "hone": true,
    "rarity": "hone",
    "displayType": "improvement",
    "glyph": {
        "textureX": 80,
        "textureY": 240
    },
    "requirement": {
        "type": "tetra:modular_item",
        "improvements": {
            "shield/ricochet": 2
        }
    },
    "outcomes": [
        {
            "requiredTools": {
                "hammer": 4
            },
            "improvements": {
                "shield/ricochet": 3
            }
        }
    ]
}