{
    "replace": true,
    "slots": [
        "toolbelt/slot1",
        "toolbelt/slot2",
        "toolbelt/slot3"
    ],
    "keySuffixes": [
        "_slot1",
        "_slot2",
        "_slot3"
    ],
    "materialSlotCount": 1,
    "glyph": {
        "textureX": 96
    },
    "displayType": "major",
    "outcomes": [
        {
            "material": {
                "item": "minecraft:leather",
                "count": 2
            },
            "requiredTools": {
                "cut": 2
            },
            "moduleKey": "toolbelt/strap",
            "moduleVariant": "strap2/leather"
        },
        {
            "material": {
                "item": "minecraft:iron_ingot",
                "count": 2
            },
            "requiredTools": {
                "hammer": 4
            },
            "moduleKey": "toolbelt/strap",
            "moduleVariant": "strap2/iron"
        }
    ]
}