{
    "replace": true,
    "slots": [
        "single/binding"
    ],
    "materialSlotCount": 1,
    "displayType": "minor",
    "glyph": {
        "textureX": 88,
        "textureY": 16
    },
    "outcomes": [
        {
            "materials": ["tetra:fibre/", "tetra:skin/"],
            "moduleKey": "single/binding",
            "moduleVariant": "single_binding/"
        },
        {
            "material": {
                "item": "tetra:forged_bolt"
            },
            "moduleKey": "single/binding",
            "moduleVariant": "single_binding/bolt"
        }
    ]
}
