{
    "replace": true,
    "slots": [
        "sword/blade"
    ],
    "materialSlotCount": 0,
    "hone": true,
    "rarity": "hone",
    "displayType": "major",
    "glyph": {
        "textureX": 32,
        "textureY": 240
    },
    "requirement": {
        "type": "tetra:modular_item",
        "improvements": {
            "!blade_hone/damage": -1
        }
    },
    "outcomes": [
        {
            "requiredCapabilities": {
                "hammer": 2
            },
            "improvements": {
                "blade_hone/damage": 1
            }
        }
    ]
}