{
    "replace": true,
    "slots": [
        "double/head_left",
        "double/head_right"
    ],
    "keySuffixes": [
        "_left",
        "_right"
    ],
    "materialSlotCount": 1,
    "glyph": {
        "textureX": 64,
        "textureY": 32
    },
    "displayType": "major",
    "translation": {
        "primaryAttributes": {
            "generic.attack_damage": 3
        },
        "tools": {
            "pry": [3, 2]
        },
        "durability": 2,
        "integrity": -3,
        "magicCapacity": 3
    },
    "outcomes": [
        {
            "materials": ["tetra:wood/", "tetra:stone/", "tetra:metal/", "tetra:gem/"],
            "moduleKey": "double/claw",
            "moduleVariant": "claw/"
        }
    ]
}