{
    "replace": true,
    "slots": [
        "single/handle"
    ],
    "materialSlotCount": 1,
    "displayType": "major",
    "glyph": {
        "textureX": 16
    },
    "translation": {
        "secondaryAttributes": {
            "generic.attack_speed": -1
        },
        "secondaryEffects": {
            "throwable": [0, 1]
        },
        "durability": 1,
        "integrity": 3,
        "magicCapacity": 3
    },
    "outcomes": [
        {
            "materials": [
                "tetra:wood/", "tetra:metal/",
                "tetra:bone/", "tetra:misc/blaze_rod", "tetra:misc/end_rod", "tetra:misc/forged_beam", "tetra:misc/stick"
            ],
            "moduleKey": "single/light_handle",
            "moduleVariant": "light_handle/"
        }
    ]
}