{
    "replace": true,
    "slots": [
        "toolbelt/belt"
    ],
    "materialSlotCount": 1,
    "requirement": {
        "type": "tetra:modular_item",
        "variants": {
            "belt/sash": "toolbelt/belt"
        }
    },
    "glyph": {
        "textureY": 16
    },
    "displayType": "minor",
    "outcomes": [
        {
            "material": {
                "item": "minecraft:leather"
            },
            "requiredCapabilities": {
                "cut": 2
            },
            "moduleKey": "toolbelt/belt",
            "moduleVariant": "belt/leather"
        }
    ]
}