{
    "replace": true,
    "slots": [
        "sword/blade"
    ],
    "materialSlotCount": 1,
    "displayType": "major",
    "glyph": {
        "textureX": 32
    },
    "translation": {
        "primaryAttributes": {
            "generic.attack_damage": 3
        },
        "secondaryAttributes": {
            "generic.attack_speed": -1
        },
        "secondaryEffects": {
            "jab": -1
        },
        "tools": {
            "cut": [2, 3]
        },
        "durability": 4,
        "integrity": -3,
        "magicCapacity": 3
    },
    "outcomes": [
        {
            "materials": ["tetra:wood/", "tetra:stone/", "tetra:metal/", "tetra:gem/", "tetra:bone/"],
            "moduleKey": "sword/short_blade",
            "moduleVariant": "short_blade/"
        }
    ]
}