{
    "replace": true,
    "slots": [ "double/binding" ],
    "materialSlotCount": 1,
    "displayType": "minor",
    "rarity": "temporary",
    "requirement": {
        "type": "tetra:perk",
        "perk": "support",
        "level": {
            "min": 1
        }
    },
    "glyph": {
        "textureX": 160,
        "textureY": 16
    },
    "outcomes": [
        {
            "materials": [ "tetra:socket/" ],
            "moduleKey": "double/perk_socket_0",
            "moduleVariant": "double_perk_socket_0/",
            "experienceFactor": 1
        }
    ]
}
